{
  "run_id": "r-011",
  "app": "todo",
  "stage": "after_cutover",
  "candidate": { "digest": "sha256:2222222222222222222222222222222222222222222222222222222222222222", "targets": ["onprem", "cloud_run"] },
  "stable": { "digest": "sha256:0000000000000000000000000000000000000000000000000000000000000000", "targets": ["onprem", "cloud_run"] },
  "state": { "writes_since_cutover": true, "pii_written_onprem": false, "db_migration_backward_compatible": false }
}
