{
  "run_id": "r-015",
  "app": "todo",
  "stage": "after_cutover",
  "candidate": { "digest": "sha256:6666666666666666666666666666666666666666666666666666666666666666", "targets": ["onprem"] },
  "stable": { "digest": "sha256:0000000000000000000000000000000000000000000000000000000000000000", "targets": ["onprem", "cloud_run"] },
  "state": { "writes_since_cutover": true, "pii_written_onprem": true, "db_migration_backward_compatible": false }
}
